Sentence,Source,label
فيصل شكله ولد عبد العزيز العقل الممثل القدير,Youtube,Polite
سيئ من اخر تحديث معلق,Companies,Neutral
#عيد_ميلاد_امير_القلوبمحمد صلاح هو أمير القلوب 😘😍تحيا مصر بولادها اللى رافعين اسمها فى العالم,Tweet,Polite
ماناسبتني و خفيفه مره احسها تنكسر بسرعه,Shein,Neutral
اشتركت بالقناة مباشرة لأجل عيون الدكتور النفيسي....الله يعطيكم العافية,Youtube,Polite
هذا مره حلو وينحف لاكن صدمني القماش الاسود مو قطن بوليستر زي حق السباحه وسميك لاكن بخليه عشان موديله والرمادي قماشه قطن مريح وقصته تحلي مره لاجل كذا بخليه واسعدوني بلايك الله يسعدكم دنيا واخره,Shein,Polite
الكحكي: #وزير_الشباب_النيجيري طلب ان تعقد مصر #منتدى_شباب_العالم أكثر من مرة في العام #أخر_النهار#WorldYouthForum,Tweet,Neutral
تجي مكسوره,Shein,Neutral
حسبي الله ونعم الوكيل في البنك الأهلي دائما التطبيق يعلق ما يحول مبالغ والبطاقات كذلك تعلق وتسبب لك احراج في بعض المتاجر الله لا يعطيكم عافية,Companies,Impolite
الاخوة الكرام بالبنك الاهلي ..تطبيق الاهلي موبايل لا يعمل بالشكل المطلوب نهائيآ كالسابق ..لازم اروح للصراف ...مايصير تطبيق بلا فائدة .,Companies,Polite
واو يهبل يهبل بنات بليز لايك عرسي قريب,Shein,Neutral
ان شاءاله يكون فعال ماجربته,Shein,Neutral
"فيه تشابه بين كلام طارق السويدان و وسيم يوسف ، هل المدرسة واحد او الفكر واحد ماهو السر؟",Youtube,Neutral
إنفوجراف.. تعرف على جلسات ثالث أيام #منتدي_شباب_العالمhttps://t.co/xl9WxaxDgs https://t.co/fGa6zUgMGe,Tweet,Neutral
اتقل انتا لسة مشوفتش حاجة انتا لسة هتروح المؤسسة - عبود - طنطا - كفرالشيخ - بلطيم - شارع حمدين صباحي,Tweet,Neutral
بالأمس إعلان أن البرنامج يتضمن عودة #تيران_وصنافير_مصرية وغدا يتهم علنا من ليس معه أنه داعم لسعودتة الجزيرتين وبما أن الانتخابات ستدار بنفس الطريقة التي رفضها في 2014 إذن النتيجة كسابقتها #تواطؤ_أم_جهل_أم_متاجرة https://t.co/6mBbJmOPyO,Tweet,Neutral
في ذلك اللقاء مع تلك الكائن كم بان جليا وطنية هذا الرجل وكم هو رائع ذوبان اؤلايك النوع من الرجال في حب وطنهم واستماتتهم في النضال لاجل استرجاع الارض الشجاعة لهم عنوان والقوة جينات خاصة بهم واجمل شيئ هو صبرهم ❤❤❤,Youtube,Polite
مستطيله مره لا كنها حقت جدات,Shein,Neutral
انتو دايما متميزين كالعاده طبعا ودايما كل حاجة بجبها من عندكو تحفه وتجن بجد بجد شكرا شي ان,Shein,Polite
"الضيف ذكر انه يستخدم بطاقات الإئتمان، وانه يسددها اولا بأول ليتفادى الزيادة، وقد افتى العلماء بحرمة ذلك لأنك تكون قد وافقت على الشرط الربوي حتى وان لم تستخدمه فأنت وافقت عليه وهذا محرررررم",Youtube,Neutral
وقد تم تطويرها بعد بيعها بسنوات بطلب رسمي يمني على يد خبراء روس وخبراء يمنيين قبيل اندلاع ثورات الربيع العربي,Tweet,Neutral
" #بوابة_الفتح | حمدين صباحي لــ""الفتح"" لا أنتوي خوض الانتخابات الرئاسية المقبلةلمزيد من التفاصيل: https://t.co/3gOJgcTKit",Tweet,Neutral
تطبيق تعبان خايس مااقدر ادخل لي شهر احاول صلحوا المشكله,Companies,Impolite
البودكاست حقكم جيد ❤️,Youtube,Neutral
هذا هو الفرق بين أمير قطر تميم و ولي العهد السعودي محمد بن سلمان ؟ تعرف على,Tweet,Neutral
ابوس ايدك رد عليا ولو مرة وحدة طب قول اسمي حتي انا اسمي محمد حاتم وبحبك جدا يا صلاح ابوس ايدك رد عليا😭,Tweet,Polite
المصريين وهما بيسمعوا الاخبار ال بتحصل ف #السعوديه#مذبحة_المماليك #تيران_وصنافير_مصرية #تحطم_طايره_مروحيه_عسير https://t.co/LZUznr59Cy,Tweet,Neutral
مشكلة ان التطبيق لايفتح من اسبوع تقريبا,Companies,Neutral
للاسف بعد التحديث رافض عملية الدخول ارجو حل المشكلة,Companies,Polite
#تحية_اجلال_وتقدير_للجيش #تحية_اجلال وتقدير_للشرطة اسود مصر رجال الجيش دمتم بأمان وحفظ من الرحمن لولاهم بعد الله ماتم #منتدي_شباب_العالم بهذا الامن والحفظ اعرفوا قيمة رجال الامن ولا تنسوهم بالدعاء #اللهم_احفظ_شرطتنا_وجيشنا #تحيا_مصر https://t.co/UGkTLcaEa,Tweet,Polite
مو راضي يتحمل ع الجلكسي 6 ايج🤔,Companies,Neutral
برجعه واسع طلع,Shein,Neutral
اللي ماقدروا يكملون الحلقه علشان الانجليزي 😂انا انجليزيتي حيل بسيطه و فهمت و الكلمه اللي ماعرفها اترجمها بالعكس تقوي اللغه عندك لانه لابد منها .. نجذب على روحنا,Youtube,Neutral
#خالد_علي : سأرفع الحد الأدنى للأجور إلى 2000 جنيه.. وسأنفذ حكم تيران وصنافير .. حد يصحي الراجل دا يا جماعه .. الشعب لا ينخدع من كومبارس مرتين ولولا خالد علي لن ينجح السيسي .. #مصر,Tweet,Neutral
يعني ايه رقم الهويه كل ما ادخل رقم البطاقه ميكملش,Companies,Neutral
حلو ريحته وترطيبه بس يحتوي على بروتين الي مسامية شعره منخفضة ينتبه او يقل استخدامه مره في الشهر,Shein,Neutral
"1:42 نفهم بعض ولا نتعايش مع بعض؟ ايه؟ وبعدين؟ فهمنا وتعايشنا وين هي الحكمة؟ ووش بيصير لامنّي ما فهمتهم ولا تعايشت معهم؟ عن الهزل والعبث إلّي تسوونه!!!! تبي تفهمهم وتتعايش معهم روح لحالك لا تلزم الناس ولا حتى تعرض لهم افكارك، احتفظ فيها لنفسك.",Youtube,Impolite
ما بتعرف تناقش تركت حديثي ولحقت صورتي ومحمد صلاح واتشرف حط صورة محمد صلاح اصلا نص جدة حاطة صورة السوما وهو سوري رياضي هي رياضة كلنا عرب ومسلمين الشغلة مو يعني حاملين نفس البسبور,Tweet,Impolite
السلام عليكم ارجو حل المشكله التطبيق لا يفتح,Companies,Polite
تصفيات كأس العالم 63 كوت ديفوار 0 المغرب 2 /,Tweet,Neutral
#ايطاليا المنتخب الوحيد عبر التاريخ الذي لم يعرف الهزيمة على أرضه في كأس العالم سواء تصفيات أو نهائيات من يتخيل مصر والسعودية تاهلت وايطاليا خسر😂 ماعليش يابوفون 🌹 https://t.co/IUiwKCimIf,Tweet,Neutral
من اسوأ التطبيقات البنكية للاسف تطبيق الاهلي موبايلي ..,Companies,Neutral
وش صار في البرنامج صاير يطلب مني اسم مستخدم قبل ما كان يطلب الا رقم الحساب ورقم السري لا حول ولا قوة الابالله العلي العظيم,Companies,Neutral
الله يحفظك ويسعدك ياشيخ,Youtube,Polite
للأسف التطبيق سار سيئ ياريت تصلحون الأخطاء ولا فقدتم زباينكم,Companies,Polite
كنت اتنمى انه دكتوره الخطيب تكون وحده من اساتذتي بالجامعة. انسانه راقية و مثقفة و احب تفكيرها جدا. تحية للدكتوره بحجم سماء امريكا 😊✊🏻,Youtube,Polite
ياخي نزلت البرنامج وأدخلت البينات كامله وتم التفعيل ادخل مره ثانيه واكتب اسم المستخدم وكلمة المرور يقول خطأ في كلمت المستخدم او الرقم السري ويش المشكلة,Companies,Neutral
"ليلة كروية أفريقية حاسمة في #تصفيات_كأس_العالم لأفريقيا، وكل التمنيات بالتوفيق لكل مم #المغرب و #تونس اللي يكفيهم التعادل للصعود. -- كوت ديفوار والمغرب .. 7:30 م تونس وليبيا .. 8:30 م -- https://t.co/KEZhIRxREP",Tweet,Polite
نص ونص قماشته خفيفه ومهو راكز ومافيه دفاء ابد,Shein,Neutral
سئ هو التطبيق الوحيد عندي يفتح بعرض الشاشة مع اني مشغل التدوير ما يظبط,Companies,Neutral
"النصر
وش  جابه
قسم مجامله ذا البرنامج",Youtube,Neutral
استغفرالله واتوب اليه,Youtube,Neutral
لا والله الاسلام نعم واما العربية فلا فاغلبنا امازيغ ونحفظ القران وندرسه...واغلب الثوارنا والشهداء امازيغ...وجميعنا نعلم بما خدم الامازيغ الاسلام...وخير مثال طارق بن زياد الامازيغي الجزائري الذي فتح اوروبا قلب المسيحية ونشر الاسلام وصولا لعاية الاندلس 👑☪️🇩🇿,Youtube,Neutral
قالها الملك فيصل من ٥٠سنه ام الخبائث الصهيونيه وجميع افكار الانسلاخ الخلقي منهم,Youtube,Neutral
#منتدى_شباب_العالم الممثلةالأمريكية هيلين هانت تعلمنا فى الولايات المتحدة ان مصر أم الحضارات #تحيا_مصر https://t.co/1TtZx1SZPk,Tweet,Neutral
للأسف بعد التحديث ماقدرت ادخل التطبيق,Companies,Neutral
الحين قنوات ابوظبي الرياضية وش تستفيد يوم تنكد على المتابع انها تأخذ مباريات تصفيات المنتخبات الاوربية ل كأس العالم .. شيء يقهر ودي اتابع إيطاليا والسويد 😢💔,Tweet,Neutral
سيء التطبيق كم ليا فيه لكن في كل مره توجد مشكله أخرى ولايوجد تعديل فيه,Companies,Neutral
جميل جداً طلبية زبون وصورته عشان تشوفوه لاتنسوا تحطوا لايك صلوا على رسول الله,Shein,Neutral
الصراحه اعجبتني وانيقه مره خذيت منها ثنتين انصحكم تاخذونها وجتني نفس الصوره بظبط بليز حطو لي لايك,Shein,Polite
انصح فيهم عملين وسعرهم ممتاز,Shein,Neutral
مره حلو ومرتب وانيق خذوا مقاسكم بالضبط لايك جعله من جابك في الجنة,Shein,Polite
اهنئ سيدي خادم الحرمين الشريفين وسمو ولي العهد #محمد_بن_سلمان والشعب السعودي والأمتين العربية والإسلامية بـ #عيد_الاضحى_المبارك,Tweet,Polite
"روعة بنات ، وين رايحة حطيلي مفيد",Shein,Neutral
موقف كوميدي لاحد القصمان مع اللاعب #محمد_ صلاح في الحرم وهو ومايعرفه 👇🏼🤣 https://t.co/zRqVhTwrRB,Tweet,Neutral
حلوؤه,Shein,Neutral
الحمدلله على نعمة الإسلام,Youtube,Neutral
أصبح جدا سيئ اللي اعرفه التحديث يعني خدمات سهلة ومرنة للعميل وليس تعقيد وضياع الرمز السري ياتصلحوه يا نوقف التعامل معكم,Companies,Neutral
جزء ثاااااااااااااااااانييييي🔥🔥🔥❤❤,Youtube,Neutral
الله يرزق صاحب اليد الي بتحط الي لايك يا رب اعتق رقبة اي حدا بحطلي لايك كثير كثير كثير كثير كثير كثير كثير كثير كثير كثير كثير كثير كثير كثير كثير حلوة واو جميل جدا جدا جدا جدا جدا جدا جدا ادعموني لايكات احتاج نقاط بليز ساعدوني,Shein,Polite
حلو وهذا شكله القماش بعد الغسيل طبعا لسا ما انكوى حلوه,Shein,Neutral
"59:10 سبحان الله الشيخ ما يبدل أقواله
بموضوع السوار  قبل لا يقول بالتجربة كان بدي أذكره بمرة قال فيها عن فك السحر بالملح وقال أنه من التجرية
وبالفعل يا شيخ بموضوع السوار خذ بكلام الطبيب الأول لأن أبي كان يعمل كهربائي بمعمل وكان يتعرض لتيارات عالية (وهو معظول طبعا) لكن أثرها يبقى معه دائما مجرد ما يلمس شخص مو معزول يصعقه بشدة لحتى قالوا له على السوار الطبي أو سوار ابن سينا ومن وقت ما چابه اختفت منه الكهرباء بشكل نهائي...
اعرف تعليقي ما رح يوصل للشيخ لكن بحسب كلامه ما في مشكلة بالسوار الطبي🥲",Youtube,Neutral
غانا مصر مباراة ودية في تصفيات كاس العالم,Tweet,Neutral
البرنامج خرب على الاخر وين الدخول السريع كنت ادخل على التطبيق برقم البطاقه الاحين تغير البرنامج مافي دخول سريع والدخلول بأسم المستخدم يطلع غلط وادا سويت نسيت اسم المستخدم ولا كلمه السر يقولك لايوجد رقم مسجل برغم لي رقم مسجل واموري تمام الرجاء اصلاح البرنامج,Companies,Polite
برنامج سيئ,Companies,Neutral
الفائدة الملخصة من الحلقة هيا انه بدون وحدة المسلمين تحت قيادة تحمل هم تحرير مقدساتنا لن نحرر شبر من بلاد المسلمين,Youtube,Neutral
قميل بس قماشة ديق مع اني البس ميديم ويبرز البطن,Shein,Neutral
السلام عليكم وايد حلو,Shein,Polite
"أتحداه   ماتوصل ثلاث درجات نهائياً ، توصل درجة   ، درجة ونص ، درجتين بالكثييييير ونادرة الحدوث بعد",Youtube,Neutral
التطبيق اصبح الان اكثر صعوبه بعد التحديث الاخير ارجعو التحديث السابق حيث انه كان سهل,Companies,Neutral
الله يعطيك الصحه وطول العمر الدكتور خبره وعلم ورتبه وتواضع واحترام …,Youtube,Polite
"مقاسي سمول واخذت ميديم زي المودل وجاء تمام ، دايم ملابس ديزي شوفو المودل وش لابسه وع هذا الاساس اطلبو مقاسكم ، لونه حلو بيج بس مايل ع اصفر فاتح",Shein,Neutral
المفروض تقدم الدليل على كلامك,Youtube,Neutral
التطبيق يعلق ويسجل خروج و بطيئ جدا ارجوا حل المشاكل,Companies,Polite
اثنين,Youtube,Neutral
اللهم لا شماته بس,Youtube,Neutral
تحت التجربه,Shein,Neutral
حلو بس ضروري تطلبي لصوب الثاني,Shein,Neutral
حلوات بس يمتسحين بسرعة,Shein,Neutral
مش مهم النيل ومش مهم الغاز ومش مهم تيران وصنافير المهم كحك العيد وحلاوة المولد #عشان_تبنيها بيع ومتخليش فيها https://t.co/LIs1d5yhVA,Tweet,Neutral
زمن التفاهات ..جاتك صايعة ضايعة وتظنها رزقتك ..حسبنا ونعم الوكيل,Youtube,Neutral
"طرح سطحى... والمذيع يستمع فقك...
الإسلام دين وليس عرق.. هذا يعنى المسلمون كانوا قلة حتى فى قريش.. بس هم قريشيين",Youtube,Neutral
" &lt;img src="" /&gt; كشف هيكتور كوبر المدير الفني للمنتخب الوطني، سبب استبعاد محمد صلاح لاعب ليفربول، من قائمة المنتخب... https://t.co/GtW38X51a3",Tweet,Neutral
صراحه لي الحين ماجربتها بس مبدائيا الحجم والكميه جداً مناسبه وكبيره اكبر من الصوره تقريبا لي عيونهم صغار نفسي بس حلوه,Shein,Neutral
متعب. نوعا ما.. إذ أنه لايوجد صفحه أخرى! بعد الاستعلام عن المستفيد. في الحوالات!! ولايتمم العمليه بسهوله ابدا.. مايضرني للذهاب لمكنات الصرافه!!,Companies,Neutral
نعم الرجل الشيخ حجاج محب لعمل الخير الله يفرجها عليه,Youtube,Polite
منتجاتهم كويسه بس اسعارهم مره مرتفعه,Shein,Neutral
التطبيق غير شغال نأمل من القايمين على البرنامج الإسراع بتشغيله,Companies,Neutral
اكثر من 48 ساعه لم يقبل التحديث!!!!,Companies,Neutral
كان البرنامج يفتح معي الآن موراضي. ياليت من المطورين يحلو المشكة,Companies,Neutral
المثلث القديم (الاسكندريه (المتوقعين غرقها ب٢٠٥٠) وروما والقدس انتهى والمثلث البديل (القدس تشابهار ظفار) الهذا ارسل شاه ايران جنوده لظفار ليساعد شخص جده تيمور !,Youtube,Neutral
تحديث غير موفق لماذا يمنع استخدام التطبيق بسبب وجود الروت ؟ ليس للروت علاقة بالتعاملات المالية هي فقط للألعاب,Companies,Neutral
رهيب ممتاز جدا,Shein,Neutral
جيد في البداية,Companies,Neutral
باقي ماجرلته جربته,Shein,Neutral
الجودة والوصف جيد,Shein,Neutral
هذا الربيع العربي الحلو اللي المفروض صار في الدول العربيه تغيير وتنظيف بدون خراب واكيد مارح يعجبكم 🤣 ماجا على توقعاتكم.الشعب راضي وش لكم!,Tweet,Neutral
كل الحروب على اراضي ليست بارض المحارب فهو احتلال,Youtube,Neutral
دفتر البقالة ماعنده ربى مثل تمارا,Youtube,Neutral
حلقه جميله وشرح مفصل والاجمل هدوء الضيف والمستضيف وهالنوع من الانفتاح على الثقافات شيئ جميل نفتقده في مجتمعنا الخليجي يا ليت لو يصير طبيعي الوضع بالتوفيق لجميع الطاقم,Youtube,Polite
عاجل المتهم المقبوض عليه فى حادث #الواحات #ليبى الجنسيه وهو الذى ارشد عن مكان النقيب #محمد_الحايس,Tweet,Neutral
هذا الربيع العربي صحيح وسليم اجتثاث روس الفساد !!عبيد حاول تبداء بدارك .,Tweet,Impolite
الربيع العربي بالشرق هل هذه دلالات على ان حكامنا لا يفقهون انتهى,Tweet,Neutral
"السيسى هنا كلم الله نبيه موسى، ومن جوارنا مرّ السيد المسيح والسيدة مريم العذراء https://t.co/oCdlAmSGlV#منتدي_شباب_العالم #خالد_علي",Tweet,Neutral
جميل جدا,Shein,Neutral
لا يوجد تحديث والإصدار الحالي يطلب تحديث,Companies,Neutral
التطبيق اصبح سيئ جدآ نرجو الاصلاع ومعالجة المشكله,Companies,Polite
للاسف صار يعلق بالساعات وبعض الاوقات يخرجك من التطبيق,Companies,Polite
التحديث سيي مايفتح,Companies,Neutral
نجمة تكفي.. لا يفتح البرنامج ولا تجي رسائل من البنك . معقولة بنك بهذا المستوى البرنامح له كم يوم ولم يتم إصلاحه,Companies,Neutral
كتير حلو بس شوي كبير,Shein,Neutral
🔴#عاجل.. الرئيس #السيسي يعلن تحويل #منتدى_شباب_العالم إلى مركز دولي التفاصيل على ◄ https://t.co/Zz9Zs6yBSN https://t.co/xzH3ijjXVD,Tweet,Neutral
الأسف بعد التحديث سيئ جداً,Companies,Neutral
ما انصح فيه كانه بلسم ترا,Shein,Neutral
ثورة يناير لو كنت ذهبت للتحرير بالفعل أخرجت أجمل ما فينا اما ثورة سونيا هي بالفعل أخرجت الوساخه المصرية من قعر الكنيف,Tweet,Impolite
الله يفرج عليك يا أبو فهد,Youtube,Polite
"تعرف أنت لو استضفت حاخام يهودي من دولة يهود  سيحدثك بمعسول الكلام  أيضا 

كفا سذاجة يا مسلمين",Youtube,Impolite
مو حلو مو ثابت ولمعته غيربه مو نفس الصوره,Shein,Neutral
#تيران_وصنافير_مصرية مصرية مصرية مصرية,Tweet,Neutral
حاربوازمه الخليج بسمرات خالد الملا https://t.co/1ONfEsJLyl,Tweet,Neutral
هذا مجرد مساعد بس ما ذكرتو الكابتن قائد الطائره ليش هو كان البطل الحقيقي,Youtube,Neutral
زفت لايعمل,Companies,Impolite
هو على قيد الحياة!؟,Youtube,Neutral
اعجبي تعجبه واستسلامه بقوله: أشهد أن لا إله إلا الله وأن محمدا رسول الله,Youtube,Neutral
تره تركز مصنوع من دهن خنزير,Youtube,Neutral
هدف نبيل درار في مرمي ساحل العاج يذكرني بهدف طيب الذكر كابتن تريكة في مرماهم ٢٠٠٤ من الجهة العكسية في تصفيات كاس العالم ٢٠٠٦ #المغرب_في_المونديال,Tweet,Neutral
تعبان صار له اكثر من اسبوع ما يشتغل مباشر فقط بالبطاقة,Companies,Neutral
سئ للغاية بعد التحديث الاخير اسم المستخدم جاني برساله نصية من البنك وعند الدخول يطلع لي انه غير صحيح وش الحل؟؟؟,Companies,Neutral
"لم يرفع ضغطي الى مشايخ الدينطول السنوات الماضية ازعجونا بكل شاشةوعندما احتجناهم في وقتنا هذا صمتوا،#ازمه_الخليج #عبدالعزيز_الطريفي 💔",Tweet,Neutral
تطبيق سيء جدا .. تستغرب من بنك كبير ومعروف وخدمات الاونلاين بهذا المستوى .. يعني ايش بقيتو من عذر لغيركم !!,Companies,Neutral
جميل ولكن تركيبها صعب فما انصح بها ابدا,Shein,Neutral
يخلي الرجل شيك وفخمه يجنن لاتعدونو,Shein,Neutral
بصراحه مره عجبتني بس الي وجها صغير وماتحب تكون النظاره عليها كبيره ماراح تناسبها,Shein,Neutral
فيه الاكمام بعد من داخل نايلون يعني تساعد على الحرق والتعرق من تحت الصدر انتي تحكمين في وسعه وضوقه تبينه شاد ولا وسط على كيفك لانه شمع ما هو قاسي الي من عند البطن يعني ما يجبرك ترزين ظهرك عادي,Shein,Neutral
ابلكيشن زباله بجد,Companies,Impolite
"لا تجامل في ثلاث أشياء: 
1. اي شيء يخالف الدين 
2. اي شيء يخالف الصحة 
3. اي شيء العادات والتقاليد",Youtube,Neutral
حاربوهم,Youtube,Neutral
قريبا باذن الله عز وجل وداع الاخوان لاخيهم وداع الابناء لابيهم تحياتي للجميع,Youtube,Neutral
" عم الدوري الانجليزي . اللي هيجيب هاري كين ف شوال 😍 ""محمد صلاح""",Tweet,Neutral
كشكل وايد حلو بس يعور الريول يذبححح قطع ريولي تقطييع,Shein,Neutral
لحد الان ماوصلت,Shein,Neutral
جيده جدا المنتجات في شي ان رائعه,Shein,Neutral
حلو لكن مشكلته الحديده تطيح ويضيع ملامح الجسم لو جسمك مخصر راح يخليه مربع تصميمه مدري كيف طولي 153 وجاي طولي بالضبط قماشه استرتش,Shein,Neutral
لي شهر احاول التسجيل بهذا التطبيق وفشلت كل محاولاتي للاسف لا يليق هذا ببنك بحجم اابنك الاهلي,Companies,Neutral
المفروض تزودون العميل نضام التسديد الموبكر للقروض مثل البنوك الاخرا وكم النسبه اذا ينوي العميل التسديد,Companies,Neutral
يحتاااج له شووووااااارماااا الان,Youtube,Neutral
