Sentence,Source,label
مره فخم وقماشه حلو واقف ومرتب لونه نفس الصوره ومقاسه جاء تمام استغراله العظيم واتوب اليه استغفراله العظيم واتوب اليه,Shein,Neutral
دكتور عبدالله النفيسي محاضراتك نبغاها في جميع الوطن العربي الله يبارك فيك وحفظك,Youtube,Polite
حلوه وناعمه وتناسب اللي يدهم نحيفه ..طبعآ الإطار اللي في الساعه ذهبي والحديده اللي في الحزام فضي بس عادي على سعرها تجنن.. شوفوا الصور واعطوني لايك جعلكم للجنة,Shein,Polite
‏‪25:46‬‏ الأدلجة,Youtube,Neutral
" #بوابة_وراديو_الشباب_نيوزمرتضى منصور: ""لاعيبة الأهلى رجالة.. والحكم قابض"" - بوابة الشباب نيوز https://t.co/MUXFJDoBPy",Tweet,Neutral
المقاس كبير,Shein,Neutral
جميل ورائع بنتظار الحلقة القادمة 🌹,Youtube,Polite
"يااااه ذهب ذهب ما ودي تخلص الثواني
ودي اقتصد وانا اتابع مابي اخلصه كله 💔",Youtube,Neutral
يرفع الضغط مايفتح,Companies,Neutral
التجربه سيئه ليا فوق ٥ أشهر احاول ادخل ع حسابي يقولي لايمكنك ا اجع البنك يقولو مانقدر نفيدك طيب والحل رغم اني متأكده من الرقم السري واسم المستخدم ايش المشكله وكنت ادخل احيان من الدخول السريع وذحين شالوه ماينفع كذا نبغا نمشي أمورنا مو معقول,Companies,Neutral
كلامك دكتور طارق كله مغالطات و كل منشق منكم فضح مخططاتكم لقلب الانظمة و الانقضاض على الحكم والدليل ما حدث في مصر. ولك فيديوهات تكذب فيه نفسك,Youtube,Impolite
فيصل العقل ولد الممثل عبدالرحمن,Youtube,Neutral
ماعاد في مواهب أصلا شي طبيعي محمد صلاح ارقامه أفضل من ميسي السنة هذي.,Tweet,Neutral
"شكراً شي إن ، بضاعتهم دائما ميزه وجميله",Shein,Polite
جميل لونه نفس الصوره حلو خفيف يبين الملابس من تحته الازارير الين تحت وتفتح كامله وخياطتها خفيف بسرعه تنقطع,Shein,Neutral
منافسة 5 نجوم .. هل يستحق محمد صلاح التتويج بأفضل لاعب أفريقي؟ https://t.co/wPRDSwhlF,Tweet,Neutral
قاطعو او نقاطعكم,Youtube,Neutral
روعه,Shein,Neutral
لم تم تجربته بعد شريته من المدح الي شفته عليه,Shein,Neutral
النجم المصري محمد صلاح يقود فريقة للفوز 3 صفر https://t.co/GIt2Zjt5ib,Tweet,Neutral
ملخص مباراة التاريخ المغرب 2 0 الكوت ديفوار تصفيات كأس العالم جنون جواد بادة,Tweet,Neutral
مو اول مره اطلبها طاحت مني وطلبت ثاني ممتازة وحلوه عالوجه,Shein,Neutral
كان كويس لكن بعد التحديث,Companies,Neutral
حلوة بس مو كتير كواليتي حلو ومايلة,Shein,Neutral
بعد التحديث الأخير تعطل تسجيل الدخول على حسابي ارجو حل المشكلة في اسرع وقت ممكن,Companies,Polite
#أخبار_قطر|بلان يعزز مكانة الكوادر القطرية خارجياً #حصار_قطر https://t.co/2x1eCuxF2J https://t.co/dSdDqwa2Nn,Tweet,Neutral
حدثني احد الثقات 😂😂😂😂,Youtube,Neutral
مباراة مصر وغانا 1-1 كاملة ◄ تصفيات كأس العالم 2018 - افريقيا [ شاشة كاملة HD720P ] https://t.co/67C1x1odlJ,Tweet,Neutral
تجاربتي مع البنك الاهلي رائعه ولكن توجد مشكلة في التطبيق في بعض الاحيان يكون بطيأ جدا,Companies,Polite
حلو بس بيجي لون الصدر غير لون الاكمام قماشه بارد,Shein,Neutral
كان مره جيد بعد التحديث صارت مشكله مايدخلك 👎👎👎👎👎👎ارجو اصلح التطبيق او غيرنا الراجحي,Companies,Polite
قماشه حلو بس خفيف مرررره مايدفي وقصير كنت اتوقع يجي طويل مره بس مررره قصير وخذو اصغر من مقاسكم يجي واسع,Shein,Neutral
طلبية زبونة,Shein,Neutral
المهم الاكل والطعم والنظافه اما الديكور بيقعد عندكم ولا احد اكله . لكن واصل لان الجيل هذا مدحدر,Youtube,Neutral
السعودين عايشين بكهف ولا وشو ما تقاطعون ؟,Youtube,Neutral
السلام عليكم بقالى يومين ما بيفتح معى بعد التحديث ارجو الحل سريعا الحين صارلى اسبوع ما يفتح معى ايش المشكلة ارجو الرد,Companies,Polite
كثرت الشعوذة التي توهمنا ان اللغة العربية هي التي حاربت الاستعمار  روح ياشيخ بين() عاود قرايتك,Youtube,Impolite
اختفت خدمة سداد من البرنامج ارجو اصلاح هذه المشكله,Companies,Polite
بارك الله فيكم حلقة جميلة ومفيدة,Youtube,Polite
بعد التحديث اختفت قائمة سداد من القائمة الرئيسية.,Companies,Neutral
4.00م #زامبيا_الكاميرون #تصفيات_كأس_العالم https://t.co/cFwOhkeWSZ,Tweet,Neutral
ماذا لو عاد معتذراً ...,Youtube,Neutral
لونه بالواقع مرره لا ماهو مثل صوره مرره لمعه,Shein,Neutral
نعم هذا الربيع العربي . الله يقويهم ويحفظهم ان شاء الله,Tweet,Polite
ما عجبني مبين رخيص ويمتن,Shein,Neutral
"التطبيق سيء جداً بعد التحديث الأخير، وما زالت المشكلة لن تُحل بعد،",Companies,Neutral
لا استطيع تحميل التطبيق لا أدري ماهو السبب؟؟؟؟,Companies,Neutral
التطبيق لا يعمل الرجاء حل المشكله,Companies,Polite
رسالة للرئيس عبد الفتاح السيسى بمحاسبة الفاسدينوزير الداخلية ومدير الانتربول المصرىيتسترون على جريمة سرقة 5... https://t.co/n58H9OAqES,Tweet,Impolite
"ليتك تأدبت و ما ناديته بومحمد ، رجل اكبر من والدك اقلها ناده شيخ لمقامه الديني",Youtube,Polite
حمى الله الدكتور,Youtube,Polite
روعه وشكلها يجنن انا البس و اخذت الموجود حلوه بس لو اخذت اكبر افضل بس إن شاء الله توسع مع الايام روعه لحد يفوته تصلح مع كل شي,Shein,Neutral
شكراً على هذه الاستضافة الرائعه,Youtube,Polite
انتا صهيوني لستم حدجسم انكم جرتوما خبيتا,Youtube,Impolite
حلو بس جاني كبير برجع واخذ اصغر منه,Shein,Neutral
رووووعة الوانهم وعددهم كثير,Shein,Neutral
ما حبيت ما حلو ابداً,Shein,Neutral
"للتصحيح ( عثمان بن معمر العنقري التميمي ) وليس الخالدي ، وحلقه من اجمل الحلقات ، وعني شخصيا اي محاضره للدكتور ، اسمعها ، لثراء المعلومات وحسن المنطق وفايدته الكبيره",Youtube,Polite
"كان من دعاء عمر بن عبد العزيز رحمه الله : اللهم أصلح من كان في صلاحه صلاح لأمة محمد ، اللهم وأهلك من كان في هلاكه صلاح لأمة محمد",Tweet,Neutral
"مملكتنا يكفيها فخراً ، في عز الربيع العربي والعالم تتصارع لجلب حقوقها .. هتف الشعب بقلب رجال كلنا #آل_سعود فلا مساومة على الوطن سواء من حاكم او فرد من الشعب. والعزاء للحاسدين. 🇸🇦 روحي وماملكت يداي فداه.🇸🇦",Tweet,Neutral
ازفت من الزفت الله لايوفقهم باعونا برخيص يردون يتمنونا بالغالي,Companies,Impolite
بارك الله فيكم وجزاكم كل خير....حقيقي اكثر مم من رائع❤❤❤,Youtube,Polite
وصلو ميات الف,Youtube,Neutral
للاسف كلامك صح,Youtube,Neutral
يوجد مشكلة حقيقة بالتطبيق الناس تمشي لقدام و التطبيق يرجع وراء!!!!,Companies,Neutral
بعد التحديث أصبح التطبيق ماله داعي للأسف,Companies,Neutral
انا  جبته كله,Youtube,Neutral
الحساب لم يعد يعمل مايقبل كلمه السر,Companies,Neutral
المراة السعودية طالبت بحقوقها وهي نقطة تحول الدولة,Youtube,Neutral
الكابالا يشار اليه بانه السحر الاسود اليهودي,Youtube,Neutral
انا اسف لكن مره طلبت وبلغتهم ان الطلب ناقص وعطوني قيمه الطلب وطلبت فيها بعدها سويت نفس الشي وعطوني قيمته بس الثالثه قفطوني,Youtube,Neutral
تجنن مره تعجبني نظاراتهم,Shein,Neutral
لو انه اختار الايس كريم كان احسن,Youtube,Neutral
حتى لو ثمانُ ساعات مثل اسم قناتكم لا نمل 😊 وفقكم الله للخير دائما😊,Youtube,Polite
غير مناسب ولايحفظ اسم المستخدم وخاصية الدخول السريع,Companies,Neutral
" خبير البسطاء.. تحليلاته السهلة قربته من عامة المصريين،والشكوك حول مصادر معلوماته جعلته دومًا محل انتقاد.. ""75%من مطالب ثورة 25 يناير اقتصادية"" أبرز مقولاته",Tweet,Neutral
مايفتح لا انصحكم حتى يشوفون حل واحيانا يقول يدعم أجهزة الكمبيوتر بس وأحيانا المعلومات صحيحه ويقول خطأ,Companies,Neutral
حلو حلو,Shein,Neutral
الاندماج ما يحسن خدماتك لابد من النظر الى المشكلة ....,Companies,Neutral
منتدي شباب العالم بمدينة السلام بشرم الشيخ فاق كل التوقعات ونجاح غيرمتوقع اداريا وعلميا وثقافيا مصرعادة إلي الرياده 💞💞💞💞💞💞,Tweet,Polite
" من نجوم تصفيات كأس العالم .. قاريكا .. في الأرجنتين يلقبونه "" النمر "" .. صنع من البيرو منتخب منظم و خطف بطاقة الملحق من بين عمالقة اللعبة .. https://t.co/objipYWdOH",Tweet,Polite
لخمة ياسر 😂😂😂😂,Youtube,Neutral
"..
1:00بداية",Youtube,Neutral
للمعلوميه حتي لو فيه زلزال ممنوع يذكره او يسربون الخبر,Youtube,Neutral
افتح الرسالة حفظ موجود في البنك,Companies,Neutral
" #ولي_العهد_السعودي: #إيران ضالعة في ""عدوان عسكري مباشر""#سكاي_أخبارhttps://t.co/b6V8FdUWT0",Tweet,Neutral
مش غريبه انك تقول انه فأل سيئ رغم ان العادلي عندما كان وزير لداخلية مصر وهبت ماتسمى رياح - الربيع- العربي- على مصر وعصفت بالعادلي ونظام مبارك وجاءت باخوانك المجرمين وقياسا على ذلك فوجود العادلي بالسعوديه مستشارا لولي العهد فهذا فأل حسن لك ولامثالك باعتبار ذلك من اكبر الشروخ يتبع,Tweet,Impolite
"لسان حال المقدم يقول ""طيب جاوب على سؤالي""",Youtube,Neutral
هذا كنت مرة مترده اشتريه لكن الحمد له ربي وفقني في الاختيار شوف صورت لكم بفلاش و بدون فلاش والي فوق بدون دمج و الي تحت بعد الدمج الله يسعدكم عطوني لايك تعبت تصوير عشان تستفيدون,Shein,Polite
لا استطيع الدخول على حسابى منذ اسبوعين فبرجاء سرعة دعمكم,Companies,Polite
كريم شعر عادي الكمية قليله والعلبه ماكتب عليها معلومات الانتاج التاريخ والصنع والكميه تحصلونها على كيس التغليف بكتابه غير واضحه وشركه التوصيل غير مزوده بمكيفات وصلني الظهر وكان ساخن ولم اجربه,Shein,Neutral
اسوء تطبيق بنك فالعالم تراب تراب تراب,Companies,Impolite
" نسيت أهم حاجة...""هياخدك"" عبد الفتاح السيسي ورا مصنع الكراسي...اتقل تاخد حاجة نضيييييييفة😂😂😂😂 https://t.co/c9oGmSmNUn",Tweet,Neutral
جميل جدا صراحه,Shein,Neutral
لماذا لايتناسب هذا التطبيق مع جالكسي نوت 4 ؟؟؟ هل يوجد بديل ؟؟؟ للضرورة,Companies,Neutral
"تصادف كرة القدم أحيانا مخيف: دينو زوف: 112 مباراة مع #ايطاليا، أعتزل بعد الخسارة وخروج على يد السويد من تصفيات يورو في عام 1984. جيانلويجي #بوفون: 175 مباراة مع إيطاليا اعتزل بعد خسارة وخروج على يد #السويد من تصفيات كأس العالم 2018. #ايطاليا_السويد https://t.co/x2cL4JWuVS",Tweet,Neutral
#بالسيسى_مصر_بتعلى جيش العاشر عالميا دا لوحده إنجاز يحسب للسيد الرئيس عبد الفتاح السيسي,Tweet,Neutral
"يحسسك أنه أفضل متحدث لغة إنجليزية وأكثر شخص مثقف والطيار الوحيد ورجل الأعمال الاول في العالم وسيد القوم وأفضل ميكانيكي.و.و
ايش هذي البطره",Youtube,Neutral
من يطلع من المدرسة الساعه1:30,Youtube,Neutral
والله مضيف سيئ صراحة,Youtube,Impolite
تهبل بنات وقماش حلو مناسبه لصيف,Shein,Neutral
البرنامج من شهر أو أكثر صاير يعلق ويعطي خطأ بالرقم وهو صحيح. وثقيل بالفتح.. واليوم مو راضي لايفتح وان فتح ما يقبل العمليات..,Companies,Neutral
الصوت يبيله شغل لان اذا اثنين تكلمو في نفس الوقت يطلع صدا,Youtube,Neutral
ماكرون يؤكد خلال لقائه ولي العهد السعودي على أمن واستقرار وسيادة #لبنانhttps://t.co/MjD5N87Fkz #فرنسا #السعودية #إستقالة_الحريري https://t.co/JfFRS8RLO,Tweet,Neutral
تكلم كلام قوي وماحد يتكلم فيه عن موضوع الاستحقاق النفسي .. فعلا المجتمع كبر بكلام الاستحقاق والتفريغ وعدم الصبر,Youtube,Neutral
تجنن مره ونفس الصورة,Shein,Neutral
"لابد الإنتباه لهذا النوع من الفيديوهات  والرجوع إلى التاريخ في تلك الفترة كانت الفرس والروم هم المحتلين،  قطبين الاكثر قوة في العالَم، وفي عهد النبي صلى الله عليه وسلم جاء التجار من بلاد الروم واخبروه بأن روما تعد العدة للاغارة عليه. وقد اخبر القرأن بان الروم ستنتصر على الفرس وهذا ماحدث بالفعل.
للاضافة المسلمين  هم من قضى علي بطش الفايكينغ في اروبا فقد كانت مقبرتهم الأندلس.تفاصيل كثير يجب البحث فيها.",Youtube,Neutral
طب وال باع تيران وصنافير,Tweet,Neutral
حدوث التطبيق نبغاه مثل تطبيق الراجحي,Companies,Neutral
انت لو في منك اتنين كمان .منسافرش روسياا الا ع النهائي بقاا 😂💙 #محمد_صلاح,Tweet,Neutral
#اتلتيكو_مدريدفى أسبانيا الريال أو البرسا غير كدة لا الدورى الانجليزى اقوى وممكن تجيله فرص احسن والافضل محمد صلاح يكمل الموسم مع ليفربول.,Tweet,Neutral
اشهد بالله اني احبة حجاج الشيخ ❤,Youtube,Polite
تحفه جدا رائع و الوان تحفه انصح بيه جدا لا يفوتكمممممممممممممممممممممممممممممممممممممممممممممممممممممممم,Shein,Neutral
"حلو بس خصره كبير لي خصرها ضعيف بس من تحت عريضه راح تواجه هالمشكله بس الحزام يحل المشكلة،لَا إلَهَ إلَّا أَنْتَ سُبْحَانَك إنِّي كُنْت مِن الظَّالِمِين",Shein,Neutral
ماراضي يفتح,Companies,Neutral
لا يوجد تحديث,Companies,Neutral
حلو بس الي عندها مرش لاتاخذه,Shein,Neutral
جزاك الله خير يادكتور على الكلام الطيب.,Youtube,Polite
هذا العايب المخرف حتى لو كان سفير ايراني ما راح يتغنى في ايران بهالطريقه ما اقول الا الله يرحم صدام طلعنا ظالمينه,Youtube,Impolite
استغرب!! ان يكون بنك مثل الاهلي يعجز عن حل المشكله التي استغرقت اكثر من اسبوعين لا نستطيع الدخول ل التطبيق هذا ان دل يدل على الاستخفاف بالعملاء. كانت بالسابق الخدمه على مايرام لكن الان الوضع سيء جدا جدا ( الى متى)؟؟!!,Companies,Neutral
هذا اجمل منتج رئيته,Shein,Neutral
جيد نوعاً ما,Companies,Neutral
يجنن حبيت في البس,Shein,Neutral
لا تقوم الساعة حتى تكون الدنيا للكع ابن اللكع,Youtube,Neutral
المساكه نفسها صغيره ما تشيل غره,Shein,Neutral
برجعه لانه طلع صغير ومن قدام مو مريح,Shein,Neutral
والله ايلون ماسك ينحب و محبوب الله يهدي الى اسلام لان واعي و ضد صهاينه و شوا....ذ و ذكي و نادرا اشوف ولد اجنبي ذكي❤,Youtube,Neutral
اسوء تطبيق بنك في السعودية يعلق معك على طول مافيه مرونه ابد ولا اي خاصية تعديل مثل رقم جوال للاسف لا يعتمد عليه وتقيم 👎👎,Companies,Neutral
ماكان. يمدح. الصيني.,Youtube,Neutral
البرنامج يطلب تحديث ولا يقبل التحديث,Companies,Neutral
"اقترح عليك اخي المقدم ، بودكاست مع برتراند بادي ، الفرنسي ، يهتم بالعرب بشكل عام ، له صلات في قطر و الاردن ، أستاذ العلاقات الدولية ، يصوغها بنوع من الفن و الشعر",Youtube,Neutral
يوجد خلل لا استطيع دخول حسابي,Companies,Neutral
شاهد .. #محمد_صلاح يتفوق على #نيمار ويقتنص لقب جديد https://t.co/G3GWrPATWg,Tweet,Neutral
تطبيق فاشل دايم يعلق,Companies,Impolite
حبيته جدا اللون هادي جدا بعد الدمج,Shein,Neutral
لايوجد احد متعاون من مطورين البرنامج ويتجاوب مع شكاوي العملاء المشكله موجوده علي جوال سامسونج الترا ٢٠ وكذلك جوال هواوي وبعض اجهزه سامسونج لاكن الاي فون لايوجد مشاكل للتطبيق نرجو التكرم بتحديث التطبيق مره اخري ليتلائم مع الجوالات المذكوره سابقا . حسبي الله ونعم الوكيل/الاخ جمعان باعامر ارفق طريقه في التعليق اللذي كتبه لتسهل الدخول الي التطبيق وقمت بتطبيق طريقته واشتغل التطبيق شكرا للاخ جمعان باعامر,Companies,Polite
جميل جدا وانيق وفخم فخم فخم سبحان الله والحمد له ولا الله الا الله واله اكبر سبحان الله عد خلقه ورضى نفسه وعد خلقه وزنة عرشة,Shein,Neutral
حرمي إسرائيل في البحر vs حلغي اتفاقية تيران وصنافير. #lol,Tweet,Neutral
الواحد طموحه في مرشح الرئاسة بقيت ضعيفة اوي...نفسي في رئيس معندوش لجان و مؤيدين من مزبلة الشعب المصري علي السوشيال ميديا و ضد التعذيب في السجون و مؤمن بمبادئ ثورة يناير...الامور الآخري الاقتصادية و الخدمات و التعليم دي هامشية خلاص #صوتي_لخالد_علي,Tweet,Impolite
مره صغير مو نفس الصوره قد طرف الاصبع نحيف مره الكريم,Shein,Neutral
روووووووعه اخذته من المدح وماندمت الله يسعدهاالي تعلق بامانه حلوه يابنات وقويه خذوهامابتندمو الله يحرم وجههامن النار الي بتحط لايك,Shein,Polite
ماذا يقصد.برقم الهوية,Companies,Neutral
مشاء الله على المذيع ابتسامته تفتح النفس,Youtube,Polite
ليه ماهو راضي يطلع خانت اسداد الفواتير,Companies,Neutral
يا لعقلية هذا الرجل! اهنيك واهني والديك يادكتور الله يكثر من امثالك ❤❤.,Youtube,Polite
خلاص بوقف الأكل بمده 381,Youtube,Neutral
الجودة سيئه جدا الصندل خفيف والصمغ طالع من الجوانب,Shein,Neutral
التطبيق بعد اخر تحديث لاا يعمل,Companies,Neutral
سئ جدا جدا التطبيق ولا يعمل Android النجمة إجبارية,Companies,Neutral
روعه جميل جدا وناعم,Shein,Neutral
"فـــإما إلــى حــيــثُ تبدو الحياةُ لعينيك مكرمةً تنغنمً
وإمــا الــى جــدثً لم يـكـن لـيـفـرقـه بـيـتـك المظلم",Youtube,Neutral
رجعتوا لكلام الأطفال لأنهم مايدرون وش كانت تدبر لهم قطر والجزيرة من دمار الربيع العربي وثوراته اللي يعرفها الكبار جيدا,Tweet,Neutral
ولله مدرةوشاسوي اوذغت اشتراك بس بذغط,Youtube,Neutral
التطبيق غير جيد,Companies,Neutral
قاطع عشان غزة❤,Youtube,Neutral
بلد 120 مليون شهيد ❤❤❤,Youtube,Neutral
نهاية مباراة مصر و غانا في الجولة الأخيرة من تصفيات كأس العالم بالتعادل الإيجابي 1-1 https://t.co/aT2kjtmLEP,Tweet,Neutral
اختيار غير موفق,Youtube,Neutral
"برنامج رائع وضيف اروع شهادتي فيه مجروحه بصراحة عجبني المحاور بتلقائيته واعترافه بعدم معرفته ببعض المعلومات الحلقه طويله ولكن تستحق المشاهدة لما تحويه من معلومات قيمه ، يعطيكم العافيه",Youtube,Polite
بعد أن دخل الشتاء ..عامل ايه الربيع العربي؟,Tweet,Neutral
حلوه بس مو مربحه,Shein,Neutral
الاخوان جماعة دعوية سياسية,Youtube,Neutral
الحقيقه مريح جدا وسهل الاستخدام,Companies,Polite
البنك الاهلي الجديد,Companies,Neutral
"#خالد_علي محامي محترم، دافع عن ارض بلده في قضية تيران وصنافير،، والصوره المتدوله دي تركيب، لان الاستاذ خالد كان بيعمل علامة النصر ✌",Tweet,Polite
المذيع ليس له اي معرفه بالحوار ولا بالموضوع ؟ كيف صار مذيك 😮 ماندري,Youtube,Neutral
اللي يخافو الله ( يزعلون علي ) يعني انتا ما تخاف الله بشكل واضح,Youtube,Neutral
حلوة بس شوي صغيرة,Shein,Neutral
"الشعار اصبح فاشل ، عالاقل اكتبوا اسم البنك بالعربي داخل الشعار ( كل الشعارات اصبحت متشابهه وبنفس الالوان ) اقرب مثال صحتي و توكلنا وغيرها من الشعارات",Companies,Impolite
ليا شهر وانا احاول ادخل حسابي و مهو راضي واتصلت عليكم و قالولي احذفي البرنامج وارجعي حمليه و سوي استرجاع للبيانات بعد التحميل من خانة الاسترجاع تحت عاليمين؟!!!!!! وحذفتو ٦٠٠ مرة ولاطلعتلي خانة الاسترجاع ولا انفتح الحساب ولا اي بطيخ ....... الين متى يعني احتاج افتح حسابي دحين ضروري ايش الحل يعني......,Companies,Neutral
اعتقد واضح الامر.. قطع الله نسل من اثار الفتنة و قطع انفاسه شر قطيعة.. الخليج كلله في حالة تفكك و ازمة اعتقد الاطفال لازم يسكتون و الحسابات الوهمية اللي يديرها مجموعة صارت للعقلاء معروفة و اسلوبها واحد.. وجعة توجعكم و لا رحم من رباكم,Tweet,Impolite
