Sentence,Source,label
حلقة جميله جداً ومثرية شفتها اكثر من مره واطلع بفائدة جديدة كل مره .. شكراً للضيف الرائع ولكم جعلها الله في موازين حسناتكم آمين,Youtube,Polite
سئ وكرهت البنك الأهلي حصل لي هكر على حسابي وانسرقت مبالغ من حسابي من هكر واللي مزعلني ان البنك ماجاتني منه رسالة تم سحب مبلغ عشان اعرف واوقف حسابي وبطاقتي ماني عارفه فين الامان من البنك إذا اي احد يقدر يهكر حساباتنا على العموم اخدت برنت من البنك ورحت ع مركز الشرطة ورفعت بلاغ بس انتبهوا جميعا.,Companies,Neutral
ان شاء الله نحن خصمائكم دنيا واخرة ويارب فاشهد,Youtube,Neutral
غير مناسبه,Shein,Neutral
ألف مبرووووك للسعوودية تيران وصنافير ونشكر الإخوة المصريين على الأمانة العالية والصدق في التعامل 😎😍,Tweet,Polite
" الحكم الإسباني ""ماتيو لاهوز"" لم يتمالك نفسه وقام بعناق ومؤاساة الأسطورة ""بوفون"" بعد خروج #ايطاليا من تصفيات كأس العالم https://t.co/wEE3SurHEm",Tweet,Neutral
وربي حلو كأني محقه ؟,Shein,Neutral
أقسم بلله كلهم صح 😊😊😅😅😅,Youtube,Neutral
!We need to WORK#منتدي_شباب_العالم,Tweet,Neutral
محمد صلاح من خلال ليفربول يحقق فوزا على وست هام بأربعة أهداف مقابل هدف https://t.co/TlAIB7mFsT,Tweet,Neutral
الموقع والتطبيق فيها مشاكل اتمنا حل المشكله في اسرع وقت,Companies,Polite
آنصحكم بهذا خاصةً لي ماتعرف ترسم,Shein,Neutral
"مصر 🆚 غانا 🏆 الجولة السادسة ، تصفيات كأس العالم - افريقيا 🕠 اليوم ، الساعه الخامسة و النصف بتوقيت القاهره ⁦🏟️⁩ ستاد كيب كوست https://t.co/ny1IEegR1U",Tweet,Neutral
الغنوشي قيادي في تنظيم الاخونجيه الدولي شلون النهضة مو اخوان!!!!!,Youtube,Neutral
#عاجل| أ.ب. عن جنرال أمريكي: قد نلغي مناوراتنا السنوية مع دول الخليج بسبب #الأزمة_الخليجية. #امريكا #مجلس_التعاون #حصار_قطر https://t.co/2okCKlW8aE,Tweet,Neutral
المنتج جميل جداً آحتاج آلى نقاط كثيرة,Shein,Neutral
البرنامج مايفتح له اسبوعين يااخي تعلمو من الراجحي معنى الخدمات الإلكترونية,Companies,Neutral
كيف أضيف مستخدم جديد,Companies,Neutral
الربيع العربى #Russia2018 https://t.co/TVNUrZ02Q,Tweet,Neutral
قطع صغيره لكن مقيده جدا,Shein,Neutral
بارك الله فيك دكتور أسامة الجامع والقائمين على البرنامج حلقة رائعة,Youtube,Polite
٧جميل جدا و رائع جدا جدا,Shein,Neutral
خاصية تذكرني ما لها فايدة و لا حتى البصمة,Companies,Neutral
شو عنوان الحلقة؟,Youtube,Neutral
جميل جدا في البس,Shein,Neutral
للأسف الشديد هناك من لا يعلم ما وراء الكواليس واقولها بالنسبه لمن لاحول ولاقوة له الا راتبه وبس .,Companies,Neutral
انت مخطئ تماما الجزاءر عربية مسلمة منذ دخول الإسلام في القرن السابع ا,Youtube,Impolite
"بعد التحديث الجديد لم استطع الدخول ابدا ، تعطلت اشغالي و لا اقدر احول او اسدد الفواتير ، أرجو حل المشكلة بأسرع وقت ممكن .",Companies,Polite
الرجاء من ادارة البرنامج تحسين واعادة برمجة التطبيق بشكل كامل المشكلة اللتي تواجه الجميع وهي السرعه لاتوجد سرعه في التطبيق ياخذ وقت لين يسجل الدخول ياخذ وقت لتنفيذ الخدمات التطبيق بطيئ جدا مقارنة بتطبيقات بنوك اخرى,Companies,Polite
مصير بنته تحتاج فلوس وبتتواصل مع ابوها اغنى رجل 😅,Youtube,Neutral
القماش حلو بس ثقيل شوي يمشي مع الاجواء البارده وطلع مقاسه كبير شوي,Shein,Neutral
اول مرة اتعلم عن شي اسمه حوزة واحسه نظام جميل جداً للتعليم. ياليت بلدانا العربية يطبقونها ويطورونها لكن لاسباب سياسية اشوفها صعبه.,Youtube,Neutral
ياسر الحزيمي,Youtube,Neutral
جميل ويحلي بس لاسف وصلني بدون الحديدة الي تقفل الحزام قماشه كريب خفيف طويل جدا يحتاج كعب,Shein,Neutral
" #السيسي يشهد جلسة ""تحديات وقضايا تواجه شباب العالم.. سبل المواجهة المواجهة لصناعة المستقبل""#منتدى_شباب_العالم #weneedtotalk https://t.co/mWtY0VO1Fy",Tweet,Neutral
تحت اختبار,Companies,Neutral
فاعلية من فاعليات منتدى شباب العالم بشرم الشيخ .. ولقاء ممتع مع من أعشقه ويحبه قلبي لأخلاقه وعلمه الغزيى د. وسيم... https://t.co/ovjY6g03OC,Tweet,Polite
أهداف مباراة المغرب 2-0 ساحل العاج تصفيات كأس العالم شاشة كاملة HD720:,Tweet,Neutral
" ""ديلي ميل"" البريطانية: تدخل الولايات المتحدة خلف ولي العهد السعودي مباشرة قد يكون له دوافع شخصية جزئيا بسبب نقد قبل انتخابه https://t.co/PpodDRUJVt",Tweet,Neutral
فيه لمعه سيئه,Shein,Neutral
التطبيق تغير علي مايعطي خيار الدخول السريع مشكله بصراحه,Companies,Neutral
ههههههههههههههههههههـ💙🎋✨,Youtube,Neutral
بالتوفيق للمغرب و تونس #تصفيات_كأس_العالم 🇹🇳🇲🇦🙏🏼,Tweet,Polite
جدعه يا بت ياشرين وبعدين انتى لو كنتى بيعه تيران وصنافير مكنوش وقفولك الوقفه دى,Tweet,Neutral
"يا رب ردنا إلى دينك رداً جميلاً ، شكراً للمذيع وشكراً لضيف مهنا المهنا على المعلومات القيمة.",Youtube,Polite
رجعوا خيارات الدخول السريع,Companies,Neutral
تطبيق ضعيف وبطيء وما يخدم احتياج العميل..,Companies,Neutral
حلقة ثرية وتحليلات عميقة من الدكتور,Youtube,Polite
من بداية الثورة الرياضيه عندنا وانا اقول ان السوبر ليق سيقوم بقيادة صندوق الاستثمارات باذن الله,Youtube,Neutral
منع #مرتضى_منصور من خوض الانتخابات لرئاسة نادي الزمالك دي بص #العصفورة بتاعت اليوم دول,Tweet,Neutral
جميل جدا مره عجبني والمقاس مظبوط,Shein,Neutral
هل هذا البرنامج مضمون,Companies,Neutral
محمد صلاح قون,Tweet,Neutral
منتجاتهم كويسه بس اسعارهم مرتفعه,Shein,Neutral
لا يشرفنا ان يأتي للريال محمد صلاح افضل للريال حاليا,Tweet,Impolite
بعد التحديث لم يعمل البرنامج كلما ادخلت كلمة السر يقول كلمة السر خاطئه,Companies,Neutral
يجنن قليله في حقه حبيته مررررره,Shein,Neutral
بعد التحديث صار التحويل معطل والتحويل السريع معطل تطبيق زفت مايستاهل نجمه,Companies,Impolite
عطونا الكود حق الدوري لان اذ دخلنا الرابط مايدخلنا,Youtube,Neutral
جميل بس كبير برجعه,Shein,Neutral
لم يصل المنتج مع الاغراض,Shein,Neutral
"ياليت تربي لحيتك 😊
لأن حلقها لا يجوز

قد ثبت عن النبي ﷺ من حديث ابن عمررضي الله عنهما أنه قال: قصوا الشوارب وأعفوا اللحى خالفوا المشركين متفق على صحته، ورواه البخاري في صحيحه بلفظ: قصوا الشوارب ووفروا اللحى خالفوا المشركين وفي صحيح مسلم عن أبي هريرة  عن النبي ﷺ أنه قال: جزوا الشوارب وأرخوا اللحى خالفوا المجوس وهذا اللفظ في الأحاديث المذكورة يقتضي وجوب إعفاء اللحى وإرخائها،",Youtube,Neutral
حفظ الله شيخنا الحبيب❤,Youtube,Polite
اي اكيد من الايسكريم نعناع وليمون😂😂😂,Youtube,Neutral
يعلق اجلس بالساعات احاول افتح الحساب,Companies,Neutral
بينما المنتخب بيلعب ماتش في تصفيات كاس العالم أنا باتفرج على فريقين درجة تانية في البرتغال عشان وصلنا و مش مهتم 😇 https://t.co/ayV47Mcuy,Tweet,Neutral
بعد التحديث تعطل التطبيق الرجاء حل المشكلة,Companies,Polite
سئ بعد التحديث,Companies,Neutral
نعم وهذا مصدر جمال الجلسة .. ليست سريعة وانما تاخذ وقتها ونكهتها وهذا ما اعجبني في حلقات فنجان,Youtube,Polite
حلو ونفس الصوره …………………………………………………………………………………………………..,Shein,Neutral
بنات ما ابالغ كبيره مره مره مره كانها نظارات الدكتوره خلود,Shein,Neutral
افرح اذا سمعت عمر يمدح لابورت لانه جاي من عندنا ههههههههههههههههههههههههههههههه,Youtube,Neutral
"يناقش تصريحات الخارجية الألمانية حول #حصار_قطر ،والقمة الطارئة لوزراء الخارجية العرب، ومقابلة وزير الخارجية ⁩ https://t.co/LmLDeLMzmd",Tweet,Neutral
حبييييييييييييييتها مرررررررررررررة حلوة و كيوت مرررررررررررررررررررررررررررررررررررررررة جات نفس الصورة بالضبط بس في التصوير مو واضحه بس جات نفسها و ٤ حبات,Shein,Neutral
"حلقة اقل مايقال عنها انها متفرده شكرا ل بودكاست بدون ورق على هذه الحلقة ونطالب بحلقة ثانية مع الدكتور نايف، لتفكيك الكثير من المعتقدات القديمة التي إنبنا عليها المجتمع وبدءا نهضة عربية واسلامية جديدة 👍🏼",Youtube,Polite
المشاهد بعد نصف ساعه يتشتت و يمل,Youtube,Neutral
#اتعلمت_من_نكسه_يناير الثورة الحقيقية محتاجين ثورة اخلاق https://t.co/ikMcsmIT2H,Tweet,Neutral
نحتاج ضيوف سياسيين لانهم صناديق مليئه بالاسرار,Youtube,Neutral
تحفة عجبتني سو كيوت حلو جدا راأائع,Shein,Neutral
السلام عليكم ورحمه الله وبركاته بعد التحديث صار الابليكيشن ما يفتح وانا بسدد فواتير واحول من عليه ارجو حل هاذى المشكله بأسرع وقت,Companies,Polite
سىء جداا جدا,Shein,Neutral
"التطبيق و الموقع مليانين اخطاء ، تسوي استعادة كلمه السر يحولك على التمويل التأجيري ، تجي تفتح حساب جديد يقلك انتهت الجلسة يعني غصب نروح الفرع عشان نخلص امورنا !!!",Companies,Neutral
البث المباشر لمباراة مصر وغانا في تصفيات كأس العالم - يشعر بـالمحبة,Tweet,Neutral
تصفيات كأس العالم 73 تونس 0 ليبيا 0 / 73 جمهورية الكونغو 1 غينيا,Tweet,Neutral
المذيع يقرب للممثل القدير عبدالرحمن العقل؟,Youtube,Neutral
تيران وصنافير تم اختفاءهم فى عز النهار وسعد الحريري بيعمل عمرة,Tweet,Neutral
احححح كيف لذيذ😂؟,Youtube,Neutral
خفيف لكن لا يستقر بالقدم عند المشي بسرعة المطاط مايمسك بالقدم بشكل كامل,Shein,Neutral
انا مغربية بالمغرب 🇲🇦 مش بالدوحة وضد اي حصار على الاشقاء في قطر مع ان لا تربطني بهم اي علاقة لا من بعيد ولا من قريب . هادا موقف الملك والشعب,Tweet,Neutral
🔴#عاجل.. #الداخلية تكشف مكان تدريب الإرهابيين قبل حادث #الواحات التفاصيل على ◄ https://t.co/1a4jg7sWga,Tweet,Neutral
حسيته موية عادي مايثبت زين,Shein,Neutral
اديلوا رز و اخرجوا اصدقاؤه من فندق الفاسدين و سوف يجعل موافقته بعد كده مايعة و ملتويه لان ده نظام مثل نظامة اللي انتم ايدتوه في الانقلاب اللي قام به ضد شعبه و ارادة شعبه زعلانين له دلوقتي هوه ده مش كان رجلكم في القضاء علي ثورات الربيع العربي استحملوه,Tweet,Neutral
" محمد صلاح ينافس ميسي وأسينسيو في استفتاء ""ماركا"" https://t.co/DIBskzB5bs",Tweet,Neutral
اذا حلقتك ٦ ساعات رح نحضرها,Youtube,Neutral
حبيا انصح فيه بنات مكن لايك بليز,Shein,Polite
الإخوان لوَثو ديننا وأفهماياقرني ماذاعمل الربيع العربي إنهم مهدولدخول إيران.وكذالك في اليمن عندماخرجوعلىعفاش2011إلى وصلوالرافضه,Tweet,Neutral
الرزق من الله مش منها الله ساقها لكم وهي سبب بعد الله وتوفيقه لكم,Youtube,Neutral
"رائع ،جزاك خير ونفع بك الامة",Youtube,Polite
غير فعال.,Companies,Neutral
معجبببب كبير ب مقدم بودكاست ابو شنب .. مكانه أفضل القنوات الرياضية يعرف يدير الحوار بين اشخاص كل واحد يحب ناديه و الأجمل انه محايد بعد ما شفت كم حلقة ما اعرف ايش يشجع 👍 محتررررف,Youtube,Polite
يكبر الارداف ماحبيته,Shein,Neutral
يروح مع الماي والعرق والدهون,Shein,Neutral
وانت الصادقه .. جابوها بالسمبك .. مشكلة الهبل السياسي ظهرت في امثال هذه الرويبضه ..!! ثورات الربيع العربي خرجت دراكولا سياسين لا يستطيعون التجول في النهار .. ولا يعرفون شي عن معاجم السياسه ..!! لو سمحتي واحد شيشه ..!!,Tweet,Impolite
كبير ويلم الجسم ومريح لظهر مره نسبة التحكم فيه حلوه لبنات الانفصال العضلي والوالده مره حلو تحسي بالفرق بسرعه اول ماتلبسيه الله يريح قلبي وقلوبكم ويرزقنا واياكم لاتنسوني صديقاتي من الدعم تكفون,Shein,Polite
التطبيق لايعمل يطلب تحديث أرجو معالجة هذا الأمر,Companies,Polite
السلام عليكم بس المشكله كأن التطبيق يعمل ممتاز جداً الآن لايستجيب لاي معامله افيدوني زاكم الله خير انا لأعلم سبب تغير البرنامج. ؟. جمعان جوبح,Companies,Polite
ماشاء الله تبارك الخالق حلو جدا وقصير من تحت لايك لو سمحتواسبحان الله وبحمده سبحان الله العظيم,Shein,Polite
يجنن روعه جميل,Shein,Neutral
"حلقة جميلة جدا باسلوب التقديم من طاقم العمل و المعلومات المفيدة و الغنية من الدكتور
لقد استمتعت جدا بالافكار العميقة و البعد الجديد في سرد التعريفات و جزالة المعلومات 
ايضا ربط المصطلحات بالواقع مع تقديم تمثلية واقعية و عملية 
شكرا جزيلا",Youtube,Polite
الدكتور طارق سويدان رجل مثقف وعالم  ومن اجمل من روي سيرت الرسول عليه الصلاة والسلام والرجل مطلع لتاريخ الاسلامي والله اني احبك ف الله ياشيخ ونحترمك ونحترم رايك رغم الحملات الاعلاميه ضدك,Youtube,Polite
نعم تعيش في بلاد المسلمين ولكن تدفع الجزية وانت صاغر,Youtube,Neutral
لا تعجبني كلمة متحولين بل تعجبني كلمة متشبهين بالنساء والعياذ بالله,Youtube,Neutral
"والله كشخص يعمل بمجال معين بخبره ١٠ سنين لو تقول لي سو لي اسايمنت سحبت عليك انت وشركتك،

ولكن لو حديث تخرج كان بقول لك ايوه نعم معاك حق",Youtube,Neutral
يروح بسرعه و مو حلو,Shein,Neutral
اسواء بنك عرفه التاريخ,Companies,Neutral
معدل تسجيل محمد صلاح لـ الأهداف ( هدف كل 90 دقيقة ) فقط دانييل ستوريدج يمتلك معدل أفضل هذا الموسم ( هدف كل 86 دقيقة ) !! https://t.co/wykgS9P5uS,Tweet,Neutral
مجلس.الجامعة.العربية. نحن.بحاجة.الى.تضميد.الجراح.ولملمة.الشتات.بعد.الربيع.او.الجحيم.العربي.ﻻ.الى.جرات.جديدة.بعد.بغدا https://t.co/qXGvoe3FMQ,Tweet,Neutral
#لاروز_في_مصر #LaroseShopEG https://t.co/c89eEdBYG3 aeO #حادث_الواحات #الانتاج_الحربي,Tweet,Neutral
طلبته وخفت ما استخدمته ه,Shein,Neutral
حلو وانيق,Shein,Neutral
⚡️“Egypt’s first #WorldYouthForum”⚡️ #EgyptToday #WeNeedToTalk #ThisIsEgypt #Egypt #منتدي_شباب_العالم https://t.co/7VYcfVgwE,Tweet,Neutral
ده أفخم شباب مصري ده ولا إيه! ياجمالك يامصر #منتدي_شباب_العالم,Tweet,Polite
لولا كورة حماده طلبه فى تصفيات كاس الامم ماكنش المنتخب عرف يكمل مشواره فى تصفيات كأس العالم للعلم ياظرفا,Tweet,Neutral
زفت بعد التطبيق,Companies,Impolite
"بتعرف الاعلام لعب دور كبير بكل الحروب، و نحن لا يجب ان نصدق كل ما يقال، و يجب ان نتعلم من دروس الماضي، و يجب ان ننظر بالدول التي دمرت باسم الربيع العربي و هو ليس الا حرب لتحقيق مخططات أمريكا و بريطانيا كما هم كتبوا و نشروا و لكن لا احد يصدق. حرب العراق كانت إعلامية و لا نووي بها",Tweet,Neutral
#أخبار_قطر|عنابي الأشبال في نهائي بطولة «الآي.تي.أف» للتنس #حصار_قطرhttps://t.co/Jc41MkQkQa https://t.co/XVOforvNht,Tweet,Neutral
جميله وراقيه,Shein,Neutral
"قال ولي العهد السعودي الأمير محمد بن سلمان بمناسبة إطلاق مشروع المدينة الاستثمارية بتبوك، إنّ السعودية تعود إلى... https://t.co/C5XKqVgi9x",Tweet,Neutral
الشركة رؤساءها الكبار أجانب من الدول الأوروبية واللي تحتهم مكس أجانب بعد😎 فليش القررر قرررر وايد على اللغة وفي معلومكم لغة الشركة الرسمية تكون الانحليزية😊,Youtube,Neutral
التطبيق لايعمل على اندرويد 5ياريت الاهتمام وحل المشكله,Companies,Polite
الشكل نفس الصوره والمقاس تمام بس الجوده نص ونص,Shein,Neutral
المنتخب الوحيد في تاريخ تصفيات كأس العالم الذي يصل كأس العالم دون أن يدخل مرماه أي هدف المغرب https://t.co/3sblodyRKP,Tweet,Neutral
القماش سيء ويطلع صوت وشفاف ماحبيت,Shein,Neutral
السيسي: منتدى شباب العالم فرصة للضيوف للتعرف على مصر وشعبهاhttps://t.co/QEpCtALRto via https://t.co/TcODmQ0jxC,Tweet,Neutral
للتاريخ ....... المدن الجديدة التى بناها مبارك تستوعب كل لاجئى الربيع العربى!!!! فى عهد مبارك تم بناء أكثر من 12 مليون وحدة سكنية . وفى عهده تم بناء 26 مدينة جديدة غير شرم وذهب ونويبع والغردقة!!! أليست حقيقة ؟ https://t.co/5lyPrRnQe,Tweet,Neutral
قصير مره ترا و القماش حق بجامه حلوه لغرفتك,Shein,Neutral
لم تصل مع الشحنه,Shein,Neutral
ايش فيه البرنامج اذا ابغى احول يطلع لي بالاحمر رقم المستخدم للنظام BANCS غير صحيح شنو يعني 😡😡,Companies,Neutral
حليله,Shein,Neutral
استنسل الحاجب معاها مغيط لتثبيت اقدر استخدمة اكثر من مرة,Shein,Neutral
جووووووووووووووووول ولا أحلى ولا أجمل من محمد صلاح 👌👌👌👌👌👌👌😍😍😍😍😍,Tweet,Polite
"حلوة تذكرني بسفرات المالديف دائماً ، خامتها ممتازة ولونها جميل🩵، لاتنسون الايك عشان النقاط .",Shein,Neutral
اهداف مباراة مصر و غانا 1 - 1 كاملة | تعليق احمد الطيب تصفيات كاس العالم 2018 https://t.co/sf3xcRMOIW https://t.co/3sSWjdG,Tweet,Neutral
انا جبته كلها صح,Youtube,Neutral
جيد جدا لكن لم احبه لاسف,Shein,Neutral
نتمنى الخير للمملكة وحفظ الله الملك سلمان و ولي العهد والشعب السعودي الاصيل,Tweet,Polite
كتير حلوه ونوعية ممتازة جدا جدا جدا روعه ممتاز راراضي,Shein,Neutral
والله توي استوعب ان باور وصلوا اربعة مليون و ابو نوح خمسة مليون 🤓,Youtube,Neutral
ما شاء الله تبارك الرحمن نسأل الله ان  يكثر من امثالك في اظهار الحق / شخص من العيار الثقيل,Youtube,Polite
البرنامج لا يعمل في اجهزه هواوي الجديده نرجو حل هذه المشكلة,Companies,Polite
استغرب ترجي السعودية من لبنان خير ؟ياخي فية مثل يقول الي اتلدغ من الحية يخاف من الحبل الا ربعنا باتلين مع ها بوشكيم خلاص عاد مقاطعة مهمب اخير عن قطر ✋🏻كلهم عيال شريفة,Tweet,Neutral
"التطبيق لايرسل رمز التفعيل على الجوال للدخول للتطبيق ، مع العلم أن هذه المشكلة ظهرت بعد التحديث",Companies,Neutral
خلال هذا الاسبوع كان لنا شرف المشاركة في #منتدى_شباب_العالم في مدينة #شرم_الشيخ في مصر الحبيبة .. مع نخبه من شباب وشابات المملكة المتميزين والذين عمل على اختيارهم وتهيئتهم مركز الملك عبدالعزيز للحوار الوطني ممثلا في الذي يقوده بكل فخر الاستاذ الصديق https://t.co/OdHvnMyckx,Tweet,Polite
صلاح يا عاااالمي #محمد_صلاح #صلاح #مومو #ليفربول #الدوري_الانجليزي الفرعون اللي مسمع ف العالم كله شكرا يا صلاح مشرفنا ف كل مكان فخر لنا يا ابن بلدي يا عظيم ❤⚽🔴👏💪😘 https://t.co/tmXaJvrU9Z,Tweet,Polite
سرقت الكتاب من كاتب سوري أعطاك أياه ليسمع رأيك فيه فسرقته منه,Youtube,Impolite
التطبيق سئ جدا نرجوا معالجه الوضع,Companies,Polite
شارع منوشهري الي كان يقصده الدكتور,Youtube,Neutral
#روسيا_2018 ملخص نتيجة مباراة المغرب وساحل العاج في تصفيات كأس العالم روسيا 2018 https://t.co/u6tXutGVxZ https://t.co/OK9qw6suv,Tweet,Neutral
حلو ممتاز,Shein,Neutral
مش راضي يفتح معاي يرسل رسالة تعميد ما تيجي الرسالة عندي وهذا رقم الجوال المسجل ايه المشكلة,Companies,Neutral
مو قادر اخش البرنامج بعد التحديث الاخير,Companies,Neutral
#هل_ستسقط_مصر ؟ السعوديه أنتزعت منها #تيران_وصنافير والسودان تطالبها ب #حلايب_وشلاتين وأثيوبيا بنت سد النهضه سيمنع مياه النيل عنها وستعطش #مصر و #قطر مولت الأرهابيين ليحرقوا مصر من الداخل والشعب المصري نفسه صايع فقير محششين ليل نهار فتاهت عقولهم تري هل هذه نهايه مصر ؟,Tweet,Impolite
