Sentence,Source,label
البرنامج أصبح منتهي لا يشتغل في الاندرويد,Companies,Neutral
لو سمحت هو فعلا الوايت نايتس عاملين حفله ع مرتضي منصور قدام النادي دلوق تي 😳😳😳😳,Tweet,Polite
برنامج صعب كثير ومش اتعامل معاه خالص,Companies,Neutral
طلبته لصديقتي ان شاءاله يعجبها,Shein,Neutral
إسراء عبد الفتاح.. حلقة جديدة في تشويه خصوم السيسي بأساليب هابطة! https://t.co/PEsdetkEfW,Tweet,Neutral
احنا مش محتاجين مذيع احنا عايزين مرتضى منصور ✋,Tweet,Neutral
ما حبيته مره,Shein,Neutral
تحية قلك دكتور من لبنان,Youtube,Impolite
#أخبار_قطر|كلية الشرطة تستقبل المتدربين من خريجي الجامعات المدنية #حصار_قطرhttps://t.co/3ijlnlm8ai https://t.co/SOxfgqlI6T,Tweet,Neutral
جميل جدا وراقي .,Shein,Neutral
لا يوجد تحديث بيانات الهوية وهذا سيئ جدا !!,Companies,Neutral
فرج اقعيم يحاصر مقر القيادة العامة بمنطقة الرجمة شرق مدينة بنغازي وانباء عن هروب خليفة حفتر الى جزر المالديف,Tweet,Neutral
البرنامج زي الزفت بعد التحديث .. . كل ما ادخل الرقم السري يخبرني ان الرقم خطأ علماً بأني استخدم الاهلي اون لاين كثيراً ولم يرفض رقمي السري إلا بعد التحديث #رد على تعليقي بأسرع وقت ممكن#,Companies,Impolite
قاطعو منتجات امريكا,Youtube,Neutral
اهداف محمد صلاح اليوم ويتربع على صدارة هدافين الدورى الانجليزى:,Tweet,Neutral
ولي العهد السعودى.. قول وفعل.. المساس بالمملكة خط أحمر,Tweet,Neutral
انيقه باللبس مرررررررررررررررره,Shein,Neutral
تجننن مره بس جتني مشخوفه,Shein,Neutral
#الملك_يحارب_الفساد #السعوديه #محاربة_الفساد #الملك_سلمان #محمد_بن_سلمان الحمدالله حكومتنا هي اللي انتفضت وحاربت الفساد وخائنين الامانه في اغلب الدول الشعب هم اللي ينتفضون على الحكومات والمفسدين الله يعز قادتنا وملكنا ويحفظهم ويبارك لهم في كل مافيه صلاح للبلد وشعبه🇸🇦,Tweet,Polite
#بوابة_الوفد||شاهد.. بث مباشر لجلسات اليوم الثالث لـ #منتدى_شباب_العالم https://t.co/6GixxzNn9N https://t.co/XFmN2DO7cU,Tweet,Neutral
"عسى الله يجزاكم كل خير على هالحلقه اللي صج نشكر جهودكم عليها .. دكتور نايف الله يرضى عليه فعلاً هالكلام اللي نحتاجه ف هالوقت لانه بدينا نضيع ومب فاهمين الوضع من حولنا حالياً ..( ملخصها عندنا اعظم دين ، راسم لنا مسار الحياه الصحيحه لكن علينا انه نعرف دينا اكثر .. وحياتنا بدون الاسلام لا تسوي شيء )",Youtube,Polite
#ايطاليا لا تتأهل لكأس العالم ٢٠١٨ في روسيا وتخرج من ملحق تصفيات أوروبا #كأس_العالم يفقد أحد أركانه ☹️,Tweet,Neutral
مرتضي منصور يشيد ب إداء الاهلي و يتهم الحكم ب الرشوة طب إيه ننسحب يا حاج,Tweet,Neutral
سي خاصه في نظام التحويلات,Companies,Neutral
يادكتور تحدث عن تاريخ استعباد الرومان للخليجيين والعرب,Youtube,Polite
من ٥ ايام لا تستطيع الدخول هل هناك عطل الى الان معقول,Companies,Neutral
خلاص 😂😂,Youtube,Neutral
البرنامج يظهر بالعرض ولا يمكن الاستفادة منه ياليت تجدو لنا حل,Companies,Polite
حلوه ذي طلبتها لأختي لانها بطيئة في الميكب ف صارت تنجز بسرعه الحين بسب هاذي اتمنى افدتكم لايك بليز ماتخسرون شي بس انا يفيدني,Shein,Polite
ماله فايدة خايس ما يحول داخلى الا اذا سجلت بالصراف اسم المستفيد علاش انتا مسوى تطبيق عشان كل مرة ابغى احول لاحد يقولى ما ماهو مستفيد ليش ما يخلون ادخل رقم اللى ابى احوله وخلاص ما يستاهل ولا نجمه,Companies,Impolite
كلام منمق و ضيف جميل البيان و الكلام ولكن كثيييييير من الافكار بعيده عن المنطق و الواقعيه و اعتقد ان الضيف يرى من زاويته و كأن البيتكوين هي حل جميع المشاكل و الحروب فعلاً كلام و تقديم ممتع ولكن غير واقعي و غير مفيد,Youtube,Polite
"جزاكم الله خيراً وبارك فيكم وحفظكم ونفع بكم
حلقة رائعة جدا جدا
أستمع إلى الحوار وأقول في نفسي وأبكي على رجال أمتنا الأخيار مثل هذا الدكتور، كيف غابوا أو غُيِّبوا علينا، واستغلهم الغرب!!
حـــــســــبــــنــا اللـــــــــه ونـــعــــم الـــوكـــيــــل 
شكرا لكم على هذه القناة، 
أسأل الله العظيم أن تكون مباركة نافعة، 
أسأل الله لكم مزيدا من التوفيق والسداد",Youtube,Polite
"لا يعمل، الدخول السريع يقول ممنوع للعملاء ولافي خانه للدخول عن طريق اسم المستخدم والرقم السري",Companies,Neutral
صغير حجمه كانه لعبه,Shein,Neutral
ليه الغيتو الدخول برقم العميل زعلتونا منكم,Companies,Neutral
البطاطس الي جايبه هذا  مو حلال تكفى اطلع ونصح العالم منه,Youtube,Neutral
الله يحمي كل رجال الدين ويطرح البركه فيهم امين🤲,Youtube,Polite
دقيقه دقيقه الي لابس احمر تميمي؟؟,Youtube,Neutral
#امر_ملكي: تشكيل لجنة برئاسة ولي العهد السعودي تتعلق بقضايا الفساد في المال العام,Tweet,Neutral
حلوه وماسكه على الرجل خذي اكبر مقاس اذا رجلك عريضه,Shein,Neutral
طالبتها منزمان ومترده بس شفت صديقتي شاريتها واعجبتني واقتنعت فيها حلوه وعمليه احس تصلح تنلبس ف البيت احتاج لايكات ه,Shein,Neutral
بعد التحديث الجديد ايقونة السداد اختفت,Companies,Neutral
البرنامج معلق وبطيء جدا نرجوا معالجة المشكلة في أقرب وقت متعطلين جدا,Companies,Polite
غير واضح,Companies,Neutral
روعة ماهي خفيفة م تنكسر بسهولة,Shein,Neutral
بارك الله فيكم سلسلة موفقة,Youtube,Polite
للأسف مايستاهل اي تقييم,Companies,Neutral
السيسي : لن أقول لكم وداعاً ولكن أقول لكم أهلاً بكم في النسخة التالية من منتدى شباب العالم نوفمبر,Tweet,Neutral
ما اعجبن مره قمتشه خفيف والخياطه مو مضبوطه مره,Shein,Neutral
ما مصير ازمه قطر وهل الهدوء الذي نشاهده هو هدوء ما يسبق العاصفه ؟!,Tweet,Neutral
اخوي تر المسلمين كانو يدمرون اصنام بتاعت الهنود وقتلو من الهنود كثير 😂,Youtube,Neutral
التطبيق لا يعمل معي نهائيا باختصار من اسوء التطبيقات في سوق بلاي حتى نجمة مايستحقها,Companies,Impolite
تقصد حاكمية على غرار (الربيع العربي)؟ أثبتت فشلها اقلب الصفحة,Tweet,Neutral
جميل جداً وناعم,Shein,Neutral
الملتقى : مع الاعلامى علاء بسيونى ( اصداء منتدى شباب العالم بشرم الشيخ ) ..,Tweet,Neutral
اختفت خانة سداد الفواتير ليش,Companies,Neutral
#حقيقه_قناه_الجزيره عملت هذ القناه كل هذه السنوات على التحريض وبث سمومها في العالم العربي وهي من اثار الشعوب على حكوماتها في بدايات الربيع العربي,Tweet,Impolite
الفنان يحيى الفخراني في دور طفولة مرتضي منصور 😂😂,Tweet,Neutral
ذهاب ملحق تصفيات كأس العالم : #السويد_ايطاليا السويد 0 × 0 إيطاليا الاستديو التحليلي .. البث المباشر : https://t.co/QEWzVu9VtU,Tweet,Neutral
الآن... #الجزائر_نيجيريا هدف للمنتخب النيجيري دقيقة62 Bein hd3 حفيظ دراجي تصفيات_كاس_العالم #يوم_الجمعة #مباريات ...,Tweet,Neutral
ما انصحكم فيها,Shein,Neutral
"ثورة يناير هزمت لما أنت اتسجنت ، ليه يعني جايب الديب من ديله يا حبيبي ثورة يناير هزمت لما أعدائها عرفوا يشتروا أمثالك أنت ودومه وبرايز ومحمود بانجو بحفنة جنيهات وانقلبتوا على شرعية حاكم جه بتصويت حر لأول مرة في تاريخ المحروسة وأهوه ربنا قلب دايرة السوء عليك ودومه والبقية تأتي",Tweet,Impolite
"المهم أستضيف من ينفع الناس بكلامه وتجاربه وانسان عاقل وليس بمهرطق.
لا للفنانات والفنانين والمشاهير ، ماهي الفائده منهم؟
محتويات مفيده او لا احسن",Youtube,Neutral
حكيم زياش محمد صلاح وتعتمد حسب المجموعه لو مع منتخبات قويه صعب,Tweet,Neutral
آية عبد الرحمن شاهين ..قدمت آداء محترفا في جلسات منتدى شباب العالم https://t.co/ADEs3QYNjp,Tweet,Neutral
نايف بن نهار ثروه تبارك الله 👏🏼,Youtube,Polite
الحمدلله بعد تيران وصنافير جزر مصرية اتباعت والبرلمان صدق رغم حكم المحكمة جيه الدور ع النيل https://t.co/USER2JD3c,Tweet,Neutral
بارك الله فيكم 🤲🏼❤️,Youtube,Polite
لون ليس مثل لون في الصوره أغمق لون من درجة الصوره,Shein,Neutral
#اخترنا_لك| أبرزهم صلاح.. مفاتيح تأهل منتخبات أفريقيا للمونديال https://t.co/f6vWEAIEyb #محمد_صلاح #كأس_العالم https://t.co/yeiCzvGhWT,Tweet,Neutral
هل الفصل الثانى من الربيع العربى بدأ فى دول الخليج,Tweet,Neutral
تمنيت انها مغناطيس بتطلع احلى بس شكلها حلو,Shein,Neutral
لايسمح لي بالدخول رغم اني مسجل يطلب رقم البطاقة والرقم السري شغله طويله..,Companies,Neutral
«قهوجي سفنكس الذي حارب لأجل تيران وصنافير».. من هو خالد علي مرشح الرئاسة المحتمل؟ | اخبارنا اليوم https://t.co/89iAgiX4Cz,Tweet,Neutral
#المغرب بالتوفيق للمغرب وتونس في تصفيات كأس العالم وإن شاء الله يلحقون بالسعودية ومصر في المونديال ❤️,Tweet,Polite
قبل التحديث ممتاز الحين بعد التحديث سيئ جداً جداً,Companies,Neutral
من احلى الاشياء الي اشتريتها وبالبس غير غير,Shein,Neutral
البرنامج سيئ جدآ.. لم يفتح رغم اني متأكد من اسم المستخدم وكلمة المرور,Companies,Neutral
ماشاء الله تبارك الله ربي يحفظك يا أخي نايف,Youtube,Polite
عارفين ثورة ٢٥ يناير لسة منجحتش ليه؟ علشان بتتعامل باحترام مع ناس وسخة,Tweet,Impolite
خمس او ست خدمات ؟ يارجل اتقي الله في نفسك يانابغة عصرك,Youtube,Neutral
جودتها ممتازه,Shein,Neutral
يامحمد خلي الناس تهرجج,Youtube,Neutral
كان افضل قبل التحديث,Companies,Neutral
"لو تزودون البودكاست بنص أقصد به ""الترانسكريبت "" راح يكون مفيد من ناحية الترجمة للانجليزية و لغات أخرى ينتفع بها المسلمين الناطقين بالانجليزية و ينتفع بها أيضا الغربيين ،و نقطة أخرى الترانسكريبت مهم جدا لانوا اليوتيوب حاليا صار كله مربوط بأدوات الذكاء الاصطناعي  اللي تعمل ملخص للحلقات على شكل نقاط رئيسية و لها فوائد ما تعد و لا تحصى ،الرجاء القائمين على القناة ياخذوا بهذا الرأي",Youtube,Neutral
2صح 1 خطأ,Youtube,Neutral
لا تصفيات كاس العالم ايه اسكت مش انا اتاهلت اه والله اتاهلت ورايح روسيا ومش مستني الجوله الاخيره https://t.co/Ang3QuJYDk,Tweet,Neutral
يع خايس وماينحط على الخشم والص مافيه لمعه وذايب ومنكسر,Shein,Impolite
قطعه ميزة وغنية ما شاء الله شكرا شي ان,Shein,Polite
مره عجبني لونه رائع ويارب يكون مريح,Shein,Neutral
لو يشوتون معاذ بس ويجيبون اي واحد مكانه بيطلع التيم قوي 👍,Youtube,Neutral
"بودكاست ممتاز جدا و مواضيع جميلة 
يعطيكم العافية فيصل و منيرة",Youtube,Polite
تطبيق سئ جدا على جوال هونر x8ماكس ما يجى على الجوال الا بالعرض ارجوا إصلاح المشكلة,Companies,Polite
محمد صلاح علي رأس ترشيحات BBC لأفضل لاعب أفريقيالمزيد من التفاصيل: https://t.co/uLZov0xbgl,Tweet,Neutral
هذا التطبيق متوقف عن العمل على اجهزة الاندرويد منذ اكثر من شهر ويبدوا ان البنك عجز عن اصلاح المشكله,Companies,Neutral
حلوه يا بنات خذيته كنه مخور,Shein,Neutral
#WeNeedToTalk #منتدي #شباب #العالم #شرم_الشيخ #حفل #الختام @ قاعة المؤتمرات بشرم الشيخ https://t.co/lSQhAGm97T,Tweet,Neutral
مع كل  لقاء بشوفوا لدكتور خالد بحمد الله اني من اشد المتابعين لدكتور ❤,Youtube,Polite
1:29:16 بسم الله صوته هني نفس Kazuhiko Inoue ممثل صوت كاكاشي😂💯👍,Youtube,Neutral
في ليلة إيطالية حزينة .. شمس الأزوري تغيب عن المونديال لاول مرة منذ 1958 #تصفيات_كاس_العالم #مونديال_روسيا_2018 في... https://t.co/6Il9ei0cHw,Tweet,Neutral
"اود ان أطرح سؤالين للدكتور. كالتالي:
١- نظريته تعتمد على الإيمان المسبق بالله، فماذا يفعل غير المؤمن؟
٢- يقول الدكتور ان هناك طريقة عقلانية وطريقة انفعالية للعلاج النفسي الغربي، عرفنا العلاج بالطريقة العقلانية، ولكنه لم يشرح ما المقصود بالطريقة الانفعالية؟",Youtube,Polite
صار التطبيق سيى جداً يورجى الانتباه للنقد لتسجيل الدخول اين انتم يا موظفي الاهلي,Companies,Neutral
"الدكتور جزاع مبدع دائما ولكن في هذا اللقاء لم يوفق واعتقد ان الورق مهم لتسجيل النقاط المهمه
غطفان قبيله عربيه وليست يهود
ذات الصواري في عهد عثمان بن عفان رضي الله عنه وارضاه
استشهاده بالايه صحيح ولكن ذكر الايه خطأ",Youtube,Polite
وقف العدوان مو مهم بل جلب المنافع هو الاهم,Youtube,Neutral
هذا حلو على البنات الي جسمهم مرتب,Shein,Neutral
من جد الحين حسنا من جديد,Companies,Neutral
حلو حلو أخذته على المدح وجربته حلو انصحكم فيه لايك لاهنتو,Shein,Neutral
مره كبيرة ما ناسبتني,Shein,Neutral
يوجد مشكله في التطبيق بعد التحديث الأخير,Companies,Neutral
سي جدا بعد التحديث ليش مافيه الدخول السريع مثل اول اسهل وأسرع الان كل ماادخل كلمة المرور واسم المستخدم يقلي خطأ تعطلت اشغالنا من وراء ها التحديث السي,Companies,Neutral
متحدث لبق .. ذكي .. وحذر .. يعجبني 👌 .. مقابله جميله جدا .. بودكاست رااااائع,Youtube,Polite
الله يعطيك الصحة يادكتور سليمان وكذلك هذا المذيع الخلوق . المعلومات و طريقة العرض وافية و مقنعة و تجذب المشاهد الذي يتوخى الحقيقة . رغم معرفتي الكاملة لقضيتنا لكني استمعت باهتمام إلى هذا الحوار المفيد رغم كمية الألم التي تسكتني. حبذا لو ترجم هذا اللقاء إلى اللغة الإنجليزية و غيرها. و شكرا لهذه القناة,Youtube,Polite
احنا جيل قلق طول عمره واحنا لسه أجنه حصل زلزال 92 ولما روحنا الابتدائي أول دفعه أخدت سته .. وف الاعدادي خلوا الرسم ماده أساسيه وف الثانوي حصلت ثوره يناير وف الكليه ثوره 30 يونيو ..🙈,Tweet,Neutral
روعه المنتج روعه المنتج,Shein,Neutral
زباله بمعنى الكلمه ولمن رفعت شكوى سكرو الشكوى فعلا زباله و؛ خدمه سيئه,Companies,Impolite
جيل عربي كامل قتلته صورة الدور وهو يحضن ولده حسبي الله ونعم الوكيل,Youtube,Neutral
"تعطلت اشغالنا بسبب تحديثكم، لايمكن الدخول !",Companies,Neutral
#شيعي يتصل بالشيخ #محمد_العريفي فانظر ماذا حصل ! https://t.co/gzmJLKV3Is #آيات_عرابي #سميه_ماهر_فين #خطفوا_سميه_ليه ##كاس_العالم #السادات #شيخ_الازهر #علي_جمعه #جمعه_مباركه #الحرية_لعلا_وحسام #معتز_مطر #تيران_وصنافير_مصريه,Tweet,Neutral
السلام عليكم عزيزي لم استطيع الدخول كل ما ادخل يقلي الرمز معطل. اغير رمز نفس المشكله. نرجو الحل لذالك وشكرأ,Companies,Polite
تلعبون بالنعمه ياهمج,Youtube,Impolite
شكرا فريق تنظيم منتدى شباب العالم https://t.co/gbzjM9hAkx,Tweet,Polite
كثير الاعطال والتعليق,Companies,Neutral
طلب زبونه وهي راضيه عنه,Shein,Neutral
"قصة الفستااان غير مناااسبه للجسم ، غير مضبوط باللبس غررريب م أعجبني",Shein,Neutral
"دكتور عبد الله النفيسي 
انا راجعت للحضرتك لقاء سابق و عرفت اسم الشارع اليهودي في طهران 
اسم الشارع منو جهري",Youtube,Polite
روعه بالبس جميل جداً ٥ نجوم,Shein,Neutral
اخذتها لزبونة جميلة جداً لو سمحت سوي لتعليقي إعجاب,Shein,Polite
احلئ شي الهروله مع شد الجسم,Youtube,Neutral
"#تصفيات_كأس_العالم_2018| في الدقيقة 53، فرصة خطيرة للمنتخب الغاني من عرضية متقنة ولكن تعلو الكل إلى رمية تماس. التغطية: https://t.co/WZ1Al1eBQq https://t.co/Z82CMgesmS",Tweet,Neutral
حلوه تساعد في الرسم,Shein,Neutral
وين الاحترام المتبادل وانت مستضيف واحد يكفر الشيعة,Youtube,Neutral
باذن الله ساغير حسابي لبنك اخر عشان تعدلو قرف تطبيقكم ! وش هالاستخفاف بالعملاء؟ تطبيق واحد مو عارفين تصلحوه؟؟؟؟,Companies,Impolite
هذا لازم يكون رءيس لدولة عربية متعلمة,Youtube,Neutral
كل شي من شي ان روعه,Shein,Neutral
الصحة وطول العمر للعم الفنان سعد الفرج (بوبدر)..... بوبدر/الاردن,Youtube,Polite
رويترز عن مصادر: الحريري استُدعي للقاء ولي العهد السعودي ثم قدموا له خطاب الاستقالة.,Tweet,Neutral
"قال كلام ولاكن نسى بداية الكلام ان يقول : هذا من فضل ربي وهي كانت سبب وجزاها الله خير ،، لاتنسو الشكر والفضل لله في كل دبر صلاه.",Youtube,Neutral
أهداف مباراة المغرب 2-0 كوت ديفوار - تصفيات كأس العالم روسيا 2018:,Tweet,Neutral
لا حد يشتريها تفشل,Shein,Impolite
صغيرة جداً,Shein,Neutral
مبدع هذا د وربط النفس بالشريعة مو مثل اللي طاروا وراء فلسفة الغرب وفي الواقع أمتلأت عندهم المصحات النفسية,Youtube,Neutral
البزنس لازم تتحرر من كثير قيود مانزل الله بها من سلطان,Youtube,Neutral
عملو عليهم هجمه,Youtube,Neutral
"أهداني السيد قذاف الدم كتابه التوثيقي هذا، وفيه ملامح مهمة للأحداث والتاريخ،عن مؤامرة #الربيع_العربي والدور القطري فيها. إنه مرجع مهم جداً. https://t.co/j8HsjcTubo",Tweet,Polite
كان ممتاز لكن الان اصبح سيء جدا كل ماادخل اسم المستخدم يطلع غلط حلو المشكلة ضروري,Companies,Neutral
اجهضوا الربيع العربي وسيدمرهم الربيع الدموي... https://t.co/aaXHahjOnw,Tweet,Neutral
تطبيق سيء جدا.. لا حوالات ولا سداد والصفحة الرئيسية فاضية.. هذا كوم وموظفين خدمة العملاء كوم .. كل واحد يرمي على الثانية مرة واحد يقول احذف التطبيق واحمله والثاني يقول انتظر نرفع شكوى ٢٤ ساعة ويمر شهر ولا شيء تعدل والثالث يقول حول من اللاب توب.. هههههههه دس لايك تطبيق فاشل,Companies,Neutral
ما شاءلله تبارك الله اللهم بارك للدكتور ويكثر من امثاله لازم نحتاج الدكتور هذا عشان يصحينا من غفلتنا الله يهدينا بس وي ريت اذا تترجمو الحلقة بالانجليزيه عشان العالم يعرف نحن فين رايحين,Youtube,Polite
برنامجكم زق,Companies,Impolite
تطبيق فأشل كل شوي منزلين تحديث ويكون اسواء من قبله البنوك تتطور وانتم للخلف سر,Companies,Impolite
الملصقات مره قليل حرام احس مالها داعي,Shein,Neutral
يهبل يبنات يهبل احسه يشد البطن شد بس ترا نصحيه يبنات لوجه الله المشد لحاله ماينحف ولا ينحت الخصر لازم دايت والمشهد مساعد انه يصغر البطن بس واله أن شاء الله فدتكم واله يسعدكم لايك ماتخسرون شي,Shein,Polite
ارع ب لبس,Shein,Neutral
التطبيق خربان من يومين عطلتونا والله,Companies,Neutral
مناسب جدا واخدت منه تانى,Shein,Neutral
سيئ جدا جدا جدا بعد التحديث مافيه احد يقدر يدخل؟؟؟؟ يازبطو تطبيقكم وموقعكم ياخلونا نروح لبنك ثاني يهتم لعملائه اكثثثثر,Companies,Neutral
كان يعمل التطبيق سابقا والان لايعمل,Companies,Neutral
محدش توقع ثورة يناير قبل حدوثها بيومين .. الفشل الاقتصادى والضغط على الناس هيحرك الشعب لا محالة .. مبارك قعد 30 سنة ولم يخاطر برفع الدعم,Tweet,Neutral
كتيييييييييييييير حلو كتيييييييييييييير حلو,Shein,Neutral
من اسبوع وانا ادخل ع التطبيق ولا تجيني رساله للدخول ع الصفحه الرئيسيه وكل أموري معطله ورفعت شكوى بأني لا أستطيع الدخول وتم رفضها ليش بصراحه أنا ما أدري,Companies,Neutral
التطبيق معلق ومايشتغل انصحكم لاحد يحدث,Companies,Neutral
ماشاءالله تبارك الرحمن شاب متطور وناجح وتفكيره راقي جدا الله يوفقه ويعلي مراتبه,Youtube,Polite
كيف ما عجبه؟؟,Youtube,Neutral
